{
  "contract_version": "purpose-registry/v1",
  "registry_status": "DRAFT_PENDING_OWNER_REVIEW",
  "legal_basis_status": "PENDING_OWNER_DECISION",
  "purposes": [
    {
      "purpose_id": "service_processing",
      "purpose_version": 1,
      "status": "DRAFT",
      "summary": "Process the user's own uploaded handwriting to produce the deterministic Free report (and any report the user separately purchases).",
      "subject_kind": "WRITER",
      "required_for_service": true,
      "affects_free_report": true,
      "presented_default": "UNSELECTED",
      "grant_scopes": ["SPECIMEN"],
      "requires_author_authority": true,
      "requires_adult_declaration": true,
      "data_categories": ["handwriting_image", "derived_measurements", "report_snapshot"],
      "recipients": ["application"],
      "retention_classes": ["upload_original", "derived_assets", "analysis_record"],
      "withdrawal": {
        "available": true,
        "effect": "PROSPECTIVE",
        "propagation": ["cancel_queued_jobs", "block_publication_of_running_jobs", "delete_per_retention_class"]
      },
      "related_gates": ["processor_retention_contracts"],
      "legal_basis": "PENDING_OWNER_DECISION",
      "not_implied_by": ["account_creation", "purchase"]
    },
    {
      "purpose_id": "image_retention",
      "purpose_version": 1,
      "status": "DRAFT",
      "summary": "Keep original images and their derivatives after the analysis so the user has a saved visual history.",
      "subject_kind": "WRITER",
      "required_for_service": false,
      "affects_free_report": false,
      "presented_default": "UNSELECTED",
      "grant_scopes": ["SUBJECT_WIDE", "SPECIMEN"],
      "requires_author_authority": true,
      "requires_adult_declaration": true,
      "data_categories": ["handwriting_image", "derived_images", "report_snapshot"],
      "recipients": ["application"],
      "retention_classes": ["upload_original", "derived_assets", "analysis_record", "export_artifacts"],
      "withdrawal": {
        "available": true,
        "effect": "PROSPECTIVE",
        "propagation": ["delete_originals_and_derivatives", "keep_report_text_only_if_service_retention_allows"]
      },
      "related_gates": ["processor_retention_contracts"],
      "legal_basis": "PENDING_OWNER_DECISION",
      "not_implied_by": ["account_creation", "purchase", "service_processing"]
    },
    {
      "purpose_id": "third_party_ai_processing",
      "purpose_version": 1,
      "status": "DRAFT",
      "summary": "Send the authorized image and evidence packet for one report to the approved Premium model provider.",
      "subject_kind": "WRITER",
      "required_for_service": false,
      "affects_free_report": false,
      "presented_default": "UNSELECTED",
      "grant_scopes": ["REPORT"],
      "requires_author_authority": true,
      "requires_adult_declaration": true,
      "data_categories": ["handwriting_image", "derived_measurements", "evidence_packet"],
      "recipients": ["premium_model_provider_pending_decision"],
      "retention_classes": ["premium_request_payload", "provider_side_copies"],
      "withdrawal": {
        "available": true,
        "effect": "PROSPECTIVE",
        "propagation": ["cancel_unstarted_premium_jobs", "block_publication_of_running_jobs", "request_processor_deletion_per_contract"]
      },
      "related_gates": ["api_access_spend_before_live_calls", "model_evaluation_and_data_controls", "processor_retention_contracts"],
      "legal_basis": "PENDING_OWNER_DECISION",
      "not_implied_by": ["purchase", "entitlement", "service_processing", "image_retention"]
    },
    {
      "purpose_id": "ordinary_sharing",
      "purpose_version": 1,
      "status": "DRAFT",
      "summary": "Disclose an allowlisted projection of one report through a revocable share link or card chosen by the user.",
      "subject_kind": "WRITER",
      "required_for_service": false,
      "affects_free_report": false,
      "presented_default": "UNSELECTED",
      "grant_scopes": ["SHARE_GRANT"],
      "requires_author_authority": true,
      "requires_adult_declaration": true,
      "data_categories": ["report_projection"],
      "recipients": ["share_link_holders"],
      "retention_classes": ["share_routes", "export_artifacts"],
      "withdrawal": {
        "available": true,
        "effect": "PROSPECTIVE",
        "propagation": ["revoke_share_routes", "delete_hosted_share_assets", "disclose_that_downloaded_copies_cannot_be_recalled"]
      },
      "related_gates": [],
      "legal_basis": "PENDING_OWNER_DECISION",
      "not_implied_by": ["purchase", "partner_comparison", "third_party_ai_processing"]
    },
    {
      "purpose_id": "partner_comparison",
      "purpose_version": 1,
      "status": "DRAFT",
      "summary": "Compare one's own sample with another author's sample; every author authorizes their own input for that comparison.",
      "subject_kind": "WRITER",
      "required_for_service": false,
      "affects_free_report": false,
      "presented_default": "UNSELECTED",
      "grant_scopes": ["COMPARISON"],
      "requires_author_authority": true,
      "requires_adult_declaration": true,
      "data_categories": ["derived_measurements", "comparison_report"],
      "recipients": ["comparison_participants"],
      "retention_classes": ["analysis_record", "share_routes"],
      "withdrawal": {
        "available": true,
        "effect": "PROSPECTIVE",
        "propagation": ["hide_comparison_from_counterparty", "revoke_comparison_share_routes"]
      },
      "related_gates": [],
      "legal_basis": "PENDING_OWNER_DECISION",
      "not_implied_by": ["ordinary_sharing", "purchase", "counterparty_invitation"]
    },
    {
      "purpose_id": "reference_contribution",
      "purpose_version": 1,
      "status": "DRAFT",
      "summary": "Allow a specimen and its measurements to become a candidate member of a versioned reference (benchmark) release.",
      "subject_kind": "WRITER",
      "required_for_service": false,
      "affects_free_report": false,
      "presented_default": "UNSELECTED",
      "grant_scopes": ["SUBJECT_WIDE", "SPECIMEN"],
      "requires_author_authority": true,
      "requires_adult_declaration": true,
      "data_categories": ["handwriting_image", "derived_measurements", "declared_context"],
      "recipients": ["application_reference_plane"],
      "retention_classes": ["reference_members"],
      "withdrawal": {
        "available": true,
        "effect": "PROSPECTIVE",
        "propagation": ["exclude_from_future_releases", "rebuild_or_retire_affected_releases", "delete_restricted_member_assets"]
      },
      "related_gates": ["pilot_rights_consent", "public_reference_validation", "benchmark_promotion"],
      "legal_basis": "PENDING_OWNER_DECISION",
      "not_implied_by": ["service_processing", "image_retention", "purchase"]
    },
    {
      "purpose_id": "engineering_evaluation",
      "purpose_version": 1,
      "status": "DRAFT",
      "summary": "Use pilot specimens for protected method accuracy, robustness and annotation work in writer-disjoint splits.",
      "subject_kind": "WRITER",
      "required_for_service": false,
      "affects_free_report": false,
      "presented_default": "UNSELECTED",
      "grant_scopes": ["PILOT_ENROLLMENT", "SPECIMEN"],
      "requires_author_authority": true,
      "requires_adult_declaration": true,
      "data_categories": ["handwriting_image", "derived_measurements", "annotations", "declared_context"],
      "recipients": ["application", "authorized_annotators"],
      "retention_classes": ["pilot_collection_originals", "annotations"],
      "withdrawal": {
        "available": true,
        "effect": "PROSPECTIVE",
        "propagation": ["quarantine_specimens", "delete_restricted_assets", "rebuild_affected_evaluation_splits"]
      },
      "related_gates": ["pilot_rights_consent", "actual_participants_and_permissions"],
      "legal_basis": "PENDING_OWNER_DECISION",
      "not_implied_by": ["reference_contribution", "service_processing", "compensation", "purchase"]
    },
    {
      "purpose_id": "support_human_review",
      "purpose_version": 1,
      "status": "DRAFT",
      "summary": "Let restricted support staff view a private sample and report to resolve a problem the user reported.",
      "subject_kind": "WRITER",
      "required_for_service": false,
      "affects_free_report": false,
      "presented_default": "UNSELECTED",
      "grant_scopes": ["SUPPORT_CASE"],
      "requires_author_authority": true,
      "requires_adult_declaration": true,
      "data_categories": ["handwriting_image", "report_snapshot", "feedback_text"],
      "recipients": ["restricted_support_staff"],
      "retention_classes": ["support_case_material"],
      "withdrawal": {
        "available": true,
        "effect": "PROSPECTIVE",
        "propagation": ["end_staff_access", "delete_case_copies"]
      },
      "related_gates": ["processor_retention_contracts"],
      "legal_basis": "PENDING_OWNER_DECISION",
      "not_implied_by": ["feedback_submission_without_explicit_choice", "purchase"]
    },
    {
      "purpose_id": "product_analytics",
      "purpose_version": 1,
      "status": "DRAFT",
      "summary": "Send allowlisted, non-handwriting product usage events to the analytics sink.",
      "subject_kind": "ACCOUNT",
      "required_for_service": false,
      "affects_free_report": false,
      "presented_default": "UNSELECTED",
      "grant_scopes": ["SUBJECT_WIDE"],
      "requires_author_authority": false,
      "requires_adult_declaration": false,
      "data_categories": ["allowlisted_usage_events"],
      "recipients": ["analytics_sink_pending_decision"],
      "retention_classes": ["analytics_events"],
      "withdrawal": {
        "available": true,
        "effect": "PROSPECTIVE",
        "propagation": ["stop_capture", "request_sink_deletion_where_supported"]
      },
      "related_gates": ["processor_retention_contracts"],